Text,Role
"Experienced Frontend Developer proficient in React JavaScript HTML and CSS. Built multiple responsive web applications.","Frontend Developer"
"Backend Engineer with expertise in Node.js Express and MongoDB. Scaled microservices architecture.","Backend Developer"
"Full Stack Developer skilled in React Node.js and SQL. Managed end-to-end product development.","Full Stack Developer"
"Data Scientist with strong background in Python R and Machine Learning. Analyzed large datasets and built predictive models.","Data Scientist"
"DevOps Engineer focused on AWS Kubernetes and Jenkins. Optimized CI/CD pipelines.","DevOps Engineer"
"Frontend wizard specialized in Vue.js and Tailwind CSS. Passionate about UI/UX.","Frontend Developer"
"Python Backend Developer using Django and Flask. Integrated REST APIs and PostgreSQL.","Backend Developer"
"Machine Learning specialist with PyTorch and TensorFlow experience. Focused on NLP.","Data Scientist"
"Cloud Engineer with Azure and Terraform certifications. Implemented infrastructure as code.","DevOps Engineer"
"React and TypeScript developer for enterprise applications. Managed state with Redux.","Frontend Developer"
"Node Express and GraphQL backend developer. Built real-time chat apps.","Backend Developer"
"Junior Full Stack Dev learning MERN stack. Built portfolio projects.","Full Stack Developer"
"Senior Data Analyst using Tableau and SQL. Provided business insights.","Data Scientist"
"Site Reliability Engineer with focus on Prometheus and Grafana monitoring.","DevOps Engineer"
